{
  "schema": "cubed-core/public-dataset-download-v1",
  "dataset_id": "cubed-solves-v1",
  "description": "Owner-recorded GAN 12 ui solve corpus (35 captures: 120 fps video, scramble records, BLE/IMU sidecars, per-artifact rights records) with Benchmark v0 result receipts, published as one immutable revision of the cubed-core/cubed-data-v1 Hugging Face dataset repository.",
  "publication_status": "published",
  "revision": "7fae604962c590ac9c658ba6ee0350e86de9c4f5",
  "source": {
    "kind": "hugging-face",
    "base_url_template": "https://huggingface.co/datasets/cubed-core/cubed-data-v1/resolve/{revision}"
  },
  "artifacts": [
    {
      "path": ".gitattributes",
      "bytes": 211,
      "sha256": "61bc284afa685f45ebd64d287fce46fb4766ac405e1c6992b95e0abf75554d20"
    },
    {
      "path": "LICENSES/DATASET.md",
      "bytes": 1640,
      "sha256": "8f366f4c03f327aff08836922c0c35dc44ca744303f96c36c46c53a43b969147"
    },
    {
      "path": "README.md",
      "bytes": 7685,
      "sha256": "b2391e1f71a409d9529470858e2af9a226bcd679eacd935a775647aa89c44dda"
    },
    {
      "path": "SHA256SUMS",
      "bytes": 29184,
      "sha256": "886e4fd4b70960d9744a9a9c074a04303b8a6c238d0e964984a338aa78b615ae"
    },
    {
      "path": "benchmark/BENCHMARK_V0_RUN_REPORT.md",
      "bytes": 9121,
      "sha256": "e5ec18bac7ccd562ef61528203b15656d093bc37fa25fccd9c0ee60ca710bd9c"
    },
    {
      "path": "benchmark/benchmark-manifest.json",
      "bytes": 56384,
      "sha256": "b3e53597678d2c71bc6b787dbb780f4c50018b8336a1d4f0b794e98097c8bbd8"
    },
    {
      "path": "benchmark/cs-eval-reachll-scores.json",
      "bytes": 8466,
      "sha256": "9e69bb592dc3356b173bfd033c106927b1a8782ba94e62e1e709a4ed5b182e94"
    },
    {
      "path": "benchmark/derivation-report.json",
      "bytes": 7909,
      "sha256": "d708202806cb52af7b9bd6924d57c9ddd232503ff7c76490dd1dac2f0185396e"
    },
    {
      "path": "benchmark/eval-freshreads-scores.json",
      "bytes": 701,
      "sha256": "9ee49efa453e1bcb48e98b380e63aa37d5755d413f2b6433a4d8ba3ce055adcf"
    },
    {
      "path": "benchmark/eval-gt-manifest.json",
      "bytes": 10149,
      "sha256": "c54f2c7b398ee585993258d19df8b6e83ab037e9f3d7dd417b2e3a03374b3b73"
    },
    {
      "path": "benchmark/hashes.json",
      "bytes": 7668,
      "sha256": "451e73f4babccd54d774703f9de059d6f21ecb37e98276a7f3e604d761884c96"
    },
    {
      "path": "benchmark/narratives/cs01.md",
      "bytes": 2402,
      "sha256": "da58745bbe83621a204d84193c24d2289ed385e401f6b79649e8de4e7306e671"
    },
    {
      "path": "benchmark/narratives/cs02.md",
      "bytes": 2406,
      "sha256": "d8be163fb853642c779f89a348795ae07a0b627f5060ed8175d21a5ad6b1520f"
    },
    {
      "path": "benchmark/narratives/cs03.md",
      "bytes": 2484,
      "sha256": "1652eb41e9123a91d2dee76ed5fbb37ce5e504571f515efcffd7e9213a50cb4c"
    },
    {
      "path": "benchmark/narratives/cs04.md",
      "bytes": 2406,
      "sha256": "e8f5b615b247f35a6c02917a30ae9878afd8c03b49be97675de8e1ae52b5bfb8"
    },
    {
      "path": "benchmark/narratives/cs05.md",
      "bytes": 2434,
      "sha256": "01520e59d7572e2464649e9d96dd73f512362307cc6e925613d201d0aaff87c7"
    },
    {
      "path": "benchmark/narratives/cs06.md",
      "bytes": 2406,
      "sha256": "792985fff6487d46eab4dab94da8debc54e132ba49690a091698c73e28614045"
    },
    {
      "path": "benchmark/narratives/cs07.md",
      "bytes": 2407,
      "sha256": "659d3ba19d498d2d9a169d84ea957b61354e43d988b616b12f637e51bcd4e2d0"
    },
    {
      "path": "benchmark/narratives/cs08.md",
      "bytes": 2406,
      "sha256": "1362d828cfdb67097f19f9ff34dfdda5e5317aeb965ef1eee5f8872839a8d279"
    },
    {
      "path": "benchmark/narratives/cs09.md",
      "bytes": 2405,
      "sha256": "0a69b96164be712cc478888cf2c43a67906992787c402d239637bf19e273878e"
    },
    {
      "path": "benchmark/narratives/cs10.md",
      "bytes": 2406,
      "sha256": "9d87df87ecb7bcc3cbfdba833b7a3a83352d10f3a3dba6040b39fa2e10599b34"
    },
    {
      "path": "benchmark/narratives/cs11.md",
      "bytes": 2406,
      "sha256": "3c3426552c2367f4b9c5fb16519ef6e8fd11ad87a1f5913fafa152e105ad6c07"
    },
    {
      "path": "benchmark/narratives/cs12.md",
      "bytes": 2363,
      "sha256": "c11f4e4e3bb6656a06869ddbf339914603f5ce6e2f7ca959aa4ebab64de629d9"
    },
    {
      "path": "benchmark/narratives/cs13.md",
      "bytes": 2408,
      "sha256": "eb288ff75b9e30e63781dcb1fa5f2aea8d00aa01021df1d3905846982a3c2f88"
    },
    {
      "path": "benchmark/narratives/cs14.md",
      "bytes": 2406,
      "sha256": "683635c6137b6375ccfe3a7157a2be9fb078f14303af76f5596886282e3e16d0"
    },
    {
      "path": "benchmark/narratives/cs15.md",
      "bytes": 2439,
      "sha256": "b06eb5f1b4a500484bc65c2b568e5d9367bc05a0277621895a78a801f60f5f00"
    },
    {
      "path": "benchmark/narratives/cs16.md",
      "bytes": 2484,
      "sha256": "a1ebb260b6fe0cc4e1745ad811d2f6cd5c7e4794d60216c01838578c7e6d5681"
    },
    {
      "path": "benchmark/narratives/cs17.md",
      "bytes": 2406,
      "sha256": "5ace5ba8b1a4dc121656161660861c1ace2c8aaf5fd617680f7b4136a8e4a83e"
    },
    {
      "path": "benchmark/narratives/cs18.md",
      "bytes": 2406,
      "sha256": "56a407e485cc2dd64aa422589d71604409bf365df39cb493f80eac578d2cac18"
    },
    {
      "path": "benchmark/narratives/cs19.md",
      "bytes": 2407,
      "sha256": "0b75df3a29cf2f1cfa57d0210dbcfae8082272f2dca37ed50079d50875d4a913"
    },
    {
      "path": "benchmark/narratives/cs20.md",
      "bytes": 2406,
      "sha256": "1c6a39f4fdf038a32ec82c3bd5bd559898bc753f7a4762e0f200c1165db293c8"
    },
    {
      "path": "benchmark/narratives/cs21.md",
      "bytes": 2405,
      "sha256": "d4904703b31d236f3fa74978eb68501b379864f2996d5a2204bcd145296f23ae"
    },
    {
      "path": "benchmark/narratives/cs22.md",
      "bytes": 2411,
      "sha256": "4755097be4cb8c60075b8a279fc15b646523a8a3e8e7133dec866545bb9134b9"
    },
    {
      "path": "benchmark/narratives/cs23.md",
      "bytes": 2408,
      "sha256": "afec04571fbae8abdeb0af461ae39da7e3a316edde2dbf77115bdf7ff6257b70"
    },
    {
      "path": "benchmark/narratives/cs24.md",
      "bytes": 2411,
      "sha256": "4edd705ffa9a9b89a9ddebfd276db2e19ca638564d756cc1edfce3441a5dce9b"
    },
    {
      "path": "benchmark/narratives/gt17.md",
      "bytes": 2651,
      "sha256": "16171de53ce5e48577cd542014988ad28d0ae1770e0f978bb4a67810bca6e769"
    },
    {
      "path": "benchmark/narratives/gt18.md",
      "bytes": 2626,
      "sha256": "f00021110609cae13be49defafc8cc3b540cbd3a3fd1bdb3fac5bad7b1f4fc32"
    },
    {
      "path": "benchmark/narratives/gt19.md",
      "bytes": 2627,
      "sha256": "e6552875f039fbff09223d3f94e26968eaa267989bcd98d09bae91ede34d9f75"
    },
    {
      "path": "benchmark/narratives/gt20.md",
      "bytes": 2705,
      "sha256": "7610cf9e6340f47d79e524a8c8448bc562b461b8c5c513d808ee928d820f91b0"
    },
    {
      "path": "benchmark/narratives/gt21.md",
      "bytes": 2709,
      "sha256": "f7413eb9412e7e85eb809e1f8af59dbf419078dec133725562a8692f632555f6"
    },
    {
      "path": "benchmark/narratives/gt22.md",
      "bytes": 2703,
      "sha256": "ae06bfe7cae2f2bad12b946e065a5a19712a43f19718de87fda5a1861ac4f9e8"
    },
    {
      "path": "benchmark/narratives/gtD1s.md",
      "bytes": 2420,
      "sha256": "c651122a27cc335b135eb827ca51b85439e91317b8afe649c2e1265dcc2fc6cc"
    },
    {
      "path": "benchmark/parity-gt-manifest.json",
      "bytes": 1996,
      "sha256": "4115d447fe1e67424ab0cf68711b05360308f625553793c75fab9ec9491125a8"
    },
    {
      "path": "benchmark/parity-reachll-scores.json",
      "bytes": 1070,
      "sha256": "580df81a2587d6e6a729b59185023b615db9673e22cbf1e982427dccd3ec0f1a"
    },
    {
      "path": "benchmark/report-test.json",
      "bytes": 8574,
      "sha256": "f0504a66e5c6257716009b9984aee0f8172b421f478898a5de6a2a47f8c03594"
    },
    {
      "path": "benchmark/report-train.json",
      "bytes": 13394,
      "sha256": "b862a445cd8bb588f390c237ca0465bce99e054fca530f4990cf8b977eb602a9"
    },
    {
      "path": "benchmark/report-validation.json",
      "bytes": 8635,
      "sha256": "811dc73fcb77eeeb753eb98836e082b35ef88136429e47ea99ccda37b3714b51"
    },
    {
      "path": "captures/0565964fe0024ac0a5ad53cd3468940b/cube_session.json",
      "bytes": 47064,
      "sha256": "a599408d6595421c9a79c055d0270de71e5e27e8fe66c12650c0fe9f792f3fec"
    },
    {
      "path": "captures/0565964fe0024ac0a5ad53cd3468940b/imu.json",
      "bytes": 498668,
      "sha256": "92690c9eb379aba3fb470aa8335a09a70976c52292c4be06e77a26bdd13f3e6b"
    },
    {
      "path": "captures/0565964fe0024ac0a5ad53cd3468940b/rights_record.json",
      "bytes": 2046,
      "sha256": "a706423e00ebb20a8e41b798a46a3e20afa011ea17f2d2a6e114ab624e6dc181"
    },
    {
      "path": "captures/0565964fe0024ac0a5ad53cd3468940b/scramble.json",
      "bytes": 1503,
      "sha256": "d7e25adf1f522eb53c730982d6db6a28d8a199f0b2f0acaadb6feee5d58aa592"
    },
    {
      "path": "captures/0565964fe0024ac0a5ad53cd3468940b/video.mp4",
      "bytes": 78680679,
      "sha256": "ebf221cb37d17d2084585f798f7efcc0b24f296bc50fd5be0c0e848b0f1d4331"
    },
    {
      "path": "captures/079b18ce0cf14f89bb68fc725e6873db/cube_session.json",
      "bytes": 62494,
      "sha256": "06b5b65bf7ba368e81da29acfc7ebea36b5762f0adf91695f02bbccc6c9ab8db"
    },
    {
      "path": "captures/079b18ce0cf14f89bb68fc725e6873db/rights_record.json",
      "bytes": 1842,
      "sha256": "5aa39907da1ecb966a97ae3ea3f50d119379c6d193e5039a5c784edc983ee223"
    },
    {
      "path": "captures/079b18ce0cf14f89bb68fc725e6873db/scramble.json",
      "bytes": 2326,
      "sha256": "8555758048649ddf530aa53b3462416dcf2905e300ad69eb4267508f5091e5ca"
    },
    {
      "path": "captures/079b18ce0cf14f89bb68fc725e6873db/video.mp4",
      "bytes": 78953840,